id,codigo_usuario,profesion_id,profesion,edad,genero,pericia_informatica,dispositivo_id,dispositivo,tiempo_segundos,completada,respuestas,comentarios_usuario,propuestas_mejora,valoracion,observaciones_facilitador
1,u01,1,Estudiante de Ingeniería del Software,22,M,alta,2,tableta,165,1,"{""pregunta1"":""Moto GP"",""pregunta2"":""3"",""pregunta3"":""7"",""pregunta4"":""Circuito"",""pregunta5"":""Fabio Quartararo"",""pregunta6"":""el diablo"",""pregunta7"":""Italia"",""pregunta8"":""30"",""pregunta9"":""3"",""pregunta10"":""37""}","Todo muy claro, ya conocía la estructura","Tablas mejorables",7,"Usuario experto, completa la prueba sin dudar, detecta detalles de presentación"
2,u02,2,Estudiante,19,F,media,1,ordenador,222,1,"{""pregunta1"":""motos"",""pregunta2"":""3"",""pregunta3"":""7"",""pregunta4"":""circuito"",""pregunta5"":""fabio quartararo"",""pregunta6"":""El diablo"",""pregunta7"":""italia"",""pregunta8"":""26"",""pregunta9"":""3"",""pregunta10"":""55""}","La información de meteorología no me queda clara al principio","Aclarar mejor la sección de meteorología",6,"Necesita orientación inicial, duda en la primera parte. resto bien"
3,u03,3,Albañil,41,M,baja,3,teléfono,400,1,"{""pregunta1"":""moto"",""pregunta2"":""-"",""pregunta3"":""7"",""pregunta4"":""Circuito"",""pregunta5"":""Fabio quartararo"",""pregunta6"":""EL diablo"",""pregunta7"":""Italia"",""pregunta8"":""30"",""pregunta9"":""3"",""pregunta10"":""62""}","no tenía claro como jugar al principio","Explicar mejor cómo funciona el juego",5,"Se pierde en la navegación, necesita instrucciones más visibles"
4,u04,4,Autónomo (bar),48,M,media,2,tableta,283,1,"{""pregunta1"":""moto gp"",""pregunta2"":""3"",""pregunta3"":""7"",""pregunta4"":""circuito"",""pregunta5"":""Quartararo"",""pregunta6"":""-"",""pregunta7"":""italia"",""pregunta8"":""31"",""pregunta9"":""3"",""pregunta10"":""48""}","Nada relevante","Aumentar tamaño de los botones del cronómetro, disposición de información",7,"Duda en la parte del juego, necesita elementos más visibles"
5,u05,5,Administrativo,38,M,media,3,teléfono,199,1,"{""pregunta1"":""carreras"",""pregunta2"":""3"",""pregunta3"":""7"",""pregunta4"":""Circuito"",""pregunta5"":""Quartararo"",""pregunta6"":""El diablo"",""pregunta7"":""Italia"",""pregunta8"":""30"",""pregunta9"":""3"",""pregunta10"":""47""}","botones del cronómetro son algo pequeños","Auemntar tamaños",7,"Ve todo bien pero los botones le cuestan"
6,u06,6,Dependienta,27,F,media,2,tableta,217,1,"{""pregunta1"":""Moto GP"",""pregunta2"":""3"",""pregunta3"":""7"",""pregunta4"":""circuito"",""pregunta5"":""Fabio Quartararo"",""pregunta6"":""el Diablo"",""pregunta7"":""italia"",""pregunta8"":""30"",""pregunta9"":""3"",""pregunta10"":""32""}","-","Mejorar interfza general, me gusta más rosa",9,"Navega con soltura"
7,u07,7,Autónoma (hotel),51,F,baja,1,ordenador,230,1,"{""pregunta1"":""moto gp"",""pregunta2"":""3"",""pregunta3"":""7"",""pregunta4"":""Circuito"",""pregunta5"":""Fabio"",""pregunta6"":""El diablo"",""pregunta7"":""it"",""pregunta8"":""30"",""pregunta9"":""3"",""pregunta10"":""51""}","La tabla se ve rara, resto bien, juego se me complicó","Aumentar contraste de la tabla",6,"Le sigue constando pero las instrucciones del juego ayudan"